GuruFocus: Using web scraping with Puppeteer
Connected to SQLite database
Database tables initialized
=== Starting Full S&P 500 GF Score Scrape ===
Total stocks to scrape: 440
Estimated time: ~22 minutes
Started at: 2:28:18 PM

GuruFocus: Starting batch fetch for 440 stocks...
GuruFocus: Saving incrementally to database after each scrape
[1/440] Scraping AAPL...
GuruFocus: Browser initialized
Scraping GuruFocus for AAPL...
Saved GF Score for AAPL
✓ AAPL: GF Score = 96
[2/440] Scraping MSFT...
Scraping GuruFocus for MSFT...
Saved GF Score for MSFT
✓ MSFT: GF Score = 99
[3/440] Scraping GOOGL...
Scraping GuruFocus for GOOGL...
Saved GF Score for GOOGL
✓ GOOGL: GF Score = 94
[4/440] Scraping AMZN...
Scraping GuruFocus for AMZN...
Saved GF Score for AMZN
✓ AMZN: GF Score = 94
[5/440] Scraping NVDA...
Scraping GuruFocus for NVDA...
Saved GF Score for NVDA
✓ NVDA: GF Score = 100
[6/440] Scraping META...
Scraping GuruFocus for META...
Saved GF Score for META
✓ META: GF Score = 99
[7/440] Scraping TSLA...
Scraping GuruFocus for TSLA...
Saved GF Score for TSLA
✓ TSLA: GF Score = 80
[8/440] Scraping BRK.B...
Scraping GuruFocus for BRK.B...
Saved GF Score for BRK.B
✓ BRK.B: GF Score = 73
[9/440] Scraping UNH...
Scraping GuruFocus for UNH...
Saved GF Score for UNH
✓ UNH: GF Score = 77
[10/440] Scraping JNJ...
Scraping GuruFocus for JNJ...
Saved GF Score for JNJ
✓ JNJ: GF Score = 91

Progress: 10/440 | Success: 10 | Failed: 0

[11/440] Scraping V...
Scraping GuruFocus for V...
Saved GF Score for V
✓ V: GF Score = 99
[12/440] Scraping XOM...
Scraping GuruFocus for XOM...
Saved GF Score for XOM
✓ XOM: GF Score = 76
[13/440] Scraping WMT...
Scraping GuruFocus for WMT...
Saved GF Score for WMT
✓ WMT: GF Score = 79
[14/440] Scraping JPM...
Scraping GuruFocus for JPM...
Saved GF Score for JPM
✓ JPM: GF Score = 78
[15/440] Scraping PG...
Scraping GuruFocus for PG...
Saved GF Score for PG
✓ PG: GF Score = 77
[16/440] Scraping MA...
Scraping GuruFocus for MA...
Saved GF Score for MA
✓ MA: GF Score = 98
[17/440] Scraping CVX...
Scraping GuruFocus for CVX...
Saved GF Score for CVX
✓ CVX: GF Score = 79
[18/440] Scraping HD...
Scraping GuruFocus for HD...
Saved GF Score for HD
✓ HD: GF Score = 91
[19/440] Scraping LLY...
Scraping GuruFocus for LLY...
Saved GF Score for LLY
✓ LLY: GF Score = 96
[20/440] Scraping ABBV...
Scraping GuruFocus for ABBV...
Saved GF Score for ABBV
✓ ABBV: GF Score = 85

Progress: 20/440 | Success: 20 | Failed: 0

[21/440] Scraping MRK...
Scraping GuruFocus for MRK...
Saved GF Score for MRK
✓ MRK: GF Score = 85
[22/440] Scraping AVGO...
Scraping GuruFocus for AVGO...
Saved GF Score for AVGO
✓ AVGO: GF Score = 85
[23/440] Scraping PEP...
Scraping GuruFocus for PEP...
Saved GF Score for PEP
✓ PEP: GF Score = 79
[24/440] Scraping KO...
Scraping GuruFocus for KO...
Saved GF Score for KO
✓ KO: GF Score = 75
[25/440] Scraping COST...
Scraping GuruFocus for COST...
Saved GF Score for COST
✓ COST: GF Score = 93
[26/440] Scraping TMO...
Scraping GuruFocus for TMO...
Saved GF Score for TMO
✓ TMO: GF Score = 93
[27/440] Scraping ADBE...
Scraping GuruFocus for ADBE...
Saved GF Score for ADBE
✓ ADBE: GF Score = 92
[28/440] Scraping MCD...
Scraping GuruFocus for MCD...
Saved GF Score for MCD
✓ MCD: GF Score = 80
[29/440] Scraping CSCO...
Scraping GuruFocus for CSCO...
Saved GF Score for CSCO
✓ CSCO: GF Score = 86
[30/440] Scraping ACN...
Scraping GuruFocus for ACN...
Saved GF Score for ACN
✓ ACN: GF Score = 87

Progress: 30/440 | Success: 30 | Failed: 0

[31/440] Scraping ABT...
Scraping GuruFocus for ABT...
Saved GF Score for ABT
✓ ABT: GF Score = 94
[32/440] Scraping DHR...
Scraping GuruFocus for DHR...
Saved GF Score for DHR
✓ DHR: GF Score = 88
[33/440] Scraping VZ...
Scraping GuruFocus for VZ...
Saved GF Score for VZ
✓ VZ: GF Score = 75
[34/440] Scraping CRM...
Scraping GuruFocus for CRM...
Saved GF Score for CRM
✓ CRM: GF Score = 93
[35/440] Scraping CMCSA...
Scraping GuruFocus for CMCSA...
Saved GF Score for CMCSA
✓ CMCSA: GF Score = 73
[36/440] Scraping NEE...
Scraping GuruFocus for NEE...
Saved GF Score for NEE
✓ NEE: GF Score = 87
[37/440] Scraping WFC...
Scraping GuruFocus for WFC...
Saved GF Score for WFC
✓ WFC: GF Score = 79
[38/440] Scraping TXN...
Scraping GuruFocus for TXN...
Saved GF Score for TXN
✓ TXN: GF Score = 90
[39/440] Scraping NKE...
Scraping GuruFocus for NKE...
Saved GF Score for NKE
✓ NKE: GF Score = 87
[40/440] Scraping PM...
Scraping GuruFocus for PM...
Saved GF Score for PM
✓ PM: GF Score = 84

Progress: 40/440 | Success: 40 | Failed: 0

[41/440] Scraping INTC...
Scraping GuruFocus for INTC...
Saved GF Score for INTC
✓ INTC: GF Score = 72
[42/440] Scraping DIS...
Scraping GuruFocus for DIS...
Saved GF Score for DIS
✓ DIS: GF Score = 87
[43/440] Scraping UNP...
Scraping GuruFocus for UNP...
Saved GF Score for UNP
✓ UNP: GF Score = 90
[44/440] Scraping AMD...
Scraping GuruFocus for AMD...
Saved GF Score for AMD
✓ AMD: GF Score = 88
[45/440] Scraping COP...
Scraping GuruFocus for COP...
Saved GF Score for COP
✓ COP: GF Score = 81
[46/440] Scraping ORCL...
Scraping GuruFocus for ORCL...
Saved GF Score for ORCL
✓ ORCL: GF Score = 83
[47/440] Scraping BMY...
Scraping GuruFocus for BMY...
Saved GF Score for BMY
✓ BMY: GF Score = 71
[48/440] Scraping RTX...
Scraping GuruFocus for RTX...
Saved GF Score for RTX
✓ RTX: GF Score = 82
[49/440] Scraping NFLX...
Scraping GuruFocus for NFLX...
Saved GF Score for NFLX
✓ NFLX: GF Score = 95
[50/440] Scraping QCOM...
Scraping GuruFocus for QCOM...
Saved GF Score for QCOM
✓ QCOM: GF Score = 89

Progress: 50/440 | Success: 50 | Failed: 0

[51/440] Scraping T...
Scraping GuruFocus for T...
Saved GF Score for T
✓ T: GF Score = 70
[52/440] Scraping UPS...
Scraping GuruFocus for UPS...
Saved GF Score for UPS
✓ UPS: GF Score = 68
[53/440] Scraping HON...
Scraping GuruFocus for HON...
Saved GF Score for HON
✓ HON: GF Score = 80
[54/440] Scraping INTU...
Scraping GuruFocus for INTU...
Saved GF Score for INTU
✓ INTU: GF Score = 99
[55/440] Scraping LOW...
Scraping GuruFocus for LOW...
Saved GF Score for LOW
✓ LOW: GF Score = 90
[56/440] Scraping BA...
Scraping GuruFocus for BA...
Saved GF Score for BA
✓ BA: GF Score = 75
[57/440] Scraping MS...
Scraping GuruFocus for MS...
Saved GF Score for MS
✓ MS: GF Score = 82
[58/440] Scraping AMGN...
Scraping GuruFocus for AMGN...
Saved GF Score for AMGN
✓ AMGN: GF Score = 86
[59/440] Scraping SPGI...
Scraping GuruFocus for SPGI...
Saved GF Score for SPGI
✓ SPGI: GF Score = 92
[60/440] Scraping CAT...
Scraping GuruFocus for CAT...
Saved GF Score for CAT
✓ CAT: GF Score = 86

Progress: 60/440 | Success: 60 | Failed: 0

[61/440] Scraping DE...
Scraping GuruFocus for DE...
Saved GF Score for DE
✓ DE: GF Score = 79
[62/440] Scraping GS...
Scraping GuruFocus for GS...
Saved GF Score for GS
✓ GS: GF Score = 78
[63/440] Scraping SBUX...
Scraping GuruFocus for SBUX...
Saved GF Score for SBUX
✓ SBUX: GF Score = 87
[64/440] Scraping IBM...
Scraping GuruFocus for IBM...
Saved GF Score for IBM
✓ IBM: GF Score = 78
[65/440] Scraping ELV...
Scraping GuruFocus for ELV...
Saved GF Score for ELV
✓ ELV: GF Score = 79
[66/440] Scraping BLK...
Scraping GuruFocus for BLK...
Saved GF Score for BLK
✓ BLK: GF Score = 92
[67/440] Scraping MDT...
Scraping GuruFocus for MDT...
Saved GF Score for MDT
✓ MDT: GF Score = 88
[68/440] Scraping PLD...
Scraping GuruFocus for PLD...
Saved GF Score for PLD
✓ PLD: GF Score = 94
[69/440] Scraping GE...
Scraping GuruFocus for GE...
Saved GF Score for GE
✓ GE: GF Score = 72
[70/440] Scraping CVS...
Scraping GuruFocus for CVS...
Saved GF Score for CVS
✓ CVS: GF Score = 84

Progress: 70/440 | Success: 70 | Failed: 0

[71/440] Scraping LMT...
Scraping GuruFocus for LMT...
Saved GF Score for LMT
✓ LMT: GF Score = 79
[72/440] Scraping AMT...
Scraping GuruFocus for AMT...
Saved GF Score for AMT
✓ AMT: GF Score = 82
[73/440] Scraping GILD...
Scraping GuruFocus for GILD...
Saved GF Score for GILD
✓ GILD: GF Score = 75
[74/440] Scraping ADI...
Scraping GuruFocus for ADI...
Saved GF Score for ADI
✓ ADI: GF Score = 94
[75/440] Scraping C...
Scraping GuruFocus for C...
Saved GF Score for C
✓ C: GF Score = 74
[76/440] Scraping AXP...
Scraping GuruFocus for AXP...
Saved GF Score for AXP
✓ AXP: GF Score = 85
[77/440] Scraping BKNG...
Scraping GuruFocus for BKNG...
Saved GF Score for BKNG
✓ BKNG: GF Score = 97
[78/440] Scraping AMAT...
Scraping GuruFocus for AMAT...
Saved GF Score for AMAT
✓ AMAT: GF Score = 94
[79/440] Scraping MDLZ...
Scraping GuruFocus for MDLZ...
Saved GF Score for MDLZ
✓ MDLZ: GF Score = 76
[80/440] Scraping SYK...
Scraping GuruFocus for SYK...
Saved GF Score for SYK
✓ SYK: GF Score = 94

Progress: 80/440 | Success: 80 | Failed: 0

[81/440] Scraping MMC...
Scraping GuruFocus for MMC...
Saved GF Score for MMC
✓ MMC: GF Score = 85
[82/440] Scraping ISRG...
Scraping GuruFocus for ISRG...
Saved GF Score for ISRG
✓ ISRG: GF Score = 95
[83/440] Scraping TJX...
Scraping GuruFocus for TJX...
Saved GF Score for TJX
✓ TJX: GF Score = 92
[84/440] Scraping NOW...
Scraping GuruFocus for NOW...
Saved GF Score for NOW
✓ NOW: GF Score = 89
[85/440] Scraping VRTX...
Scraping GuruFocus for VRTX...
Saved GF Score for VRTX
✓ VRTX: GF Score = 84
[86/440] Scraping ADP...
Scraping GuruFocus for ADP...
Saved GF Score for ADP
✓ ADP: GF Score = 92
[87/440] Scraping MO...
Scraping GuruFocus for MO...
Saved GF Score for MO
✓ MO: GF Score = 78
[88/440] Scraping CI...
Scraping GuruFocus for CI...
Saved GF Score for CI
✓ CI: GF Score = 72
[89/440] Scraping TMUS...
Scraping GuruFocus for TMUS...
Saved GF Score for TMUS
✓ TMUS: GF Score = 85
[90/440] Scraping ZTS...
Scraping GuruFocus for ZTS...
Saved GF Score for ZTS
✓ ZTS: GF Score = 88

Progress: 90/440 | Success: 90 | Failed: 0

[91/440] Scraping PGR...
Scraping GuruFocus for PGR...
Saved GF Score for PGR
✓ PGR: GF Score = 79
[92/440] Scraping BDX...
Scraping GuruFocus for BDX...
Saved GF Score for BDX
✓ BDX: GF Score = 75
[93/440] Scraping ETN...
Scraping GuruFocus for ETN...
Saved GF Score for ETN
✓ ETN: GF Score = 91
[94/440] Scraping REGN...
Scraping GuruFocus for REGN...
Saved GF Score for REGN
✓ REGN: GF Score = 87
[95/440] Scraping CB...
Scraping GuruFocus for CB...
Saved GF Score for CB
✓ CB: GF Score = 78
[96/440] Scraping SO...
Scraping GuruFocus for SO...
Saved GF Score for SO
✓ SO: GF Score = 83
[97/440] Scraping DUK...
Scraping GuruFocus for DUK...
Saved GF Score for DUK
✓ DUK: GF Score = 78
[98/440] Scraping BSX...
Scraping GuruFocus for BSX...
Saved GF Score for BSX
✓ BSX: GF Score = 91
[99/440] Scraping NOC...
Scraping GuruFocus for NOC...
Saved GF Score for NOC
✓ NOC: GF Score = 79
[100/440] Scraping SCHW...
Scraping GuruFocus for SCHW...
Saved GF Score for SCHW
✓ SCHW: GF Score = 80

Progress: 100/440 | Success: 100 | Failed: 0

[101/440] Scraping SLB...
Scraping GuruFocus for SLB...
Saved GF Score for SLB
✓ SLB: GF Score = 72
[102/440] Scraping PNC...
Scraping GuruFocus for PNC...
Saved GF Score for PNC
✓ PNC: GF Score = 82
[103/440] Scraping EOG...
Scraping GuruFocus for EOG...
Saved GF Score for EOG
✓ EOG: GF Score = 88
[104/440] Scraping ITW...
Scraping GuruFocus for ITW...
Saved GF Score for ITW
✓ ITW: GF Score = 90
[105/440] Scraping MU...
Scraping GuruFocus for MU...
Saved GF Score for MU
✓ MU: GF Score = 84
[106/440] Scraping USB...
Scraping GuruFocus for USB...
Saved GF Score for USB
✓ USB: GF Score = 74
[107/440] Scraping CL...
Scraping GuruFocus for CL...
Saved GF Score for CL
✓ CL: GF Score = 73
[108/440] Scraping MMM...
Scraping GuruFocus for MMM...
Saved GF Score for MMM
✓ MMM: GF Score = 64
[109/440] Scraping FI...
Scraping GuruFocus for FI...
Saved GF Score for FI
✓ FI: GF Score = 78
[110/440] Scraping WM...
Scraping GuruFocus for WM...
Saved GF Score for WM
✓ WM: GF Score = 90

Progress: 110/440 | Success: 110 | Failed: 0

[111/440] Scraping HUM...
Scraping GuruFocus for HUM...
Saved GF Score for HUM
✓ HUM: GF Score = 84
[112/440] Scraping APD...
Scraping GuruFocus for APD...
Saved GF Score for APD
✓ APD: GF Score = 81
[113/440] Scraping GD...
Scraping GuruFocus for GD...
Saved GF Score for GD
✓ GD: GF Score = 84
[114/440] Scraping TGT...
Scraping GuruFocus for TGT...
Saved GF Score for TGT
✓ TGT: GF Score = 79
[115/440] Scraping EMR...
Scraping GuruFocus for EMR...
Saved GF Score for EMR
✓ EMR: GF Score = 87
[116/440] Scraping CSX...
Scraping GuruFocus for CSX...
Saved GF Score for CSX
✓ CSX: GF Score = 87
[117/440] Scraping NSC...
Scraping GuruFocus for NSC...
Saved GF Score for NSC
✓ NSC: GF Score = 88
[118/440] Scraping ICE...
Scraping GuruFocus for ICE...
Saved GF Score for ICE
✓ ICE: GF Score = 81
[119/440] Scraping AON...
Scraping GuruFocus for AON...
Saved GF Score for AON
✓ AON: GF Score = 87
[120/440] Scraping MCO...
Scraping GuruFocus for MCO...
Saved GF Score for MCO
✓ MCO: GF Score = 93

Progress: 120/440 | Success: 120 | Failed: 0

[121/440] Scraping EQIX...
Scraping GuruFocus for EQIX...
Saved GF Score for EQIX
✓ EQIX: GF Score = 89
[122/440] Scraping FCX...
Scraping GuruFocus for FCX...
Saved GF Score for FCX
✓ FCX: GF Score = 90
[123/440] Scraping PSA...
Scraping GuruFocus for PSA...
Saved GF Score for PSA
✓ PSA: GF Score = 89
[124/440] Scraping DG...
Scraping GuruFocus for DG...
Saved GF Score for DG
✓ DG: GF Score = 83
[125/440] Scraping SHW...
Scraping GuruFocus for SHW...
Saved GF Score for SHW
✓ SHW: GF Score = 90
[126/440] Scraping CCI...
Scraping GuruFocus for CCI...
Saved GF Score for CCI
✓ CCI: GF Score = 66
[127/440] Scraping GM...
Scraping GuruFocus for GM...
Saved GF Score for GM
✓ GM: GF Score = 81
[128/440] Scraping MAR...
Scraping GuruFocus for MAR...
Saved GF Score for MAR
✓ MAR: GF Score = 88
[129/440] Scraping PYPL...
Scraping GuruFocus for PYPL...
Saved GF Score for PYPL
✓ PYPL: GF Score = 95
[130/440] Scraping KLAC...
Scraping GuruFocus for KLAC...
Saved GF Score for KLAC
✓ KLAC: GF Score = 93

Progress: 130/440 | Success: 130 | Failed: 0

[131/440] Scraping MET...
Scraping GuruFocus for MET...
Saved GF Score for MET
✓ MET: GF Score = 80
[132/440] Scraping MCK...
Scraping GuruFocus for MCK...
Saved GF Score for MCK
✓ MCK: GF Score = 84
[133/440] Scraping AJG...
Scraping GuruFocus for AJG...
Saved GF Score for AJG
✓ AJG: GF Score = 93
[134/440] Scraping NXPI...
Scraping GuruFocus for NXPI...
Saved GF Score for NXPI
✓ NXPI: GF Score = 95
[135/440] Scraping APH...
Scraping GuruFocus for APH...
Saved GF Score for APH
✓ APH: GF Score = 92
[136/440] Scraping ADSK...
Scraping GuruFocus for ADSK...
Saved GF Score for ADSK
✓ ADSK: GF Score = 92
[137/440] Scraping ORLY...
Scraping GuruFocus for ORLY...
Saved GF Score for ORLY
✓ ORLY: GF Score = 94
[138/440] Scraping EW...
Scraping GuruFocus for EW...
Saved GF Score for EW
✓ EW: GF Score = 93
[139/440] Scraping F...
Scraping GuruFocus for F...
Saved GF Score for F
✓ F: GF Score = 74
[140/440] Scraping TT...
Scraping GuruFocus for TT...
Saved GF Score for TT
✓ TT: GF Score = 90

Progress: 140/440 | Success: 140 | Failed: 0

[141/440] Scraping AFL...
Scraping GuruFocus for AFL...
Saved GF Score for AFL
✓ AFL: GF Score = 74
[142/440] Scraping AZO...
Scraping GuruFocus for AZO...
Saved GF Score for AZO
✓ AZO: GF Score = 93
[143/440] Scraping MSI...
Scraping GuruFocus for MSI...
Saved GF Score for MSI
✓ MSI: GF Score = 88
[144/440] Scraping HCA...
Scraping GuruFocus for HCA...
Saved GF Score for HCA
✓ HCA: GF Score = 94
[145/440] Scraping PCAR...
Scraping GuruFocus for PCAR...
Saved GF Score for PCAR
✓ PCAR: GF Score = 83
[146/440] Scraping SNPS...
Scraping GuruFocus for SNPS...
Saved GF Score for SNPS
✓ SNPS: GF Score = 87
[147/440] Scraping CME...
Scraping GuruFocus for CME...
Saved GF Score for CME
✓ CME: GF Score = 91
[148/440] Scraping PSX...
Scraping GuruFocus for PSX...
Saved GF Score for PSX
✓ PSX: GF Score = 73
[149/440] Scraping MRVL...
Scraping GuruFocus for MRVL...
Saved GF Score for MRVL
✓ MRVL: GF Score = 83
[150/440] Scraping WMB...
Scraping GuruFocus for WMB...
Saved GF Score for WMB
✓ WMB: GF Score = 78

Progress: 150/440 | Success: 150 | Failed: 0

[151/440] Scraping TFC...
Scraping GuruFocus for TFC...
Saved GF Score for TFC
✓ TFC: GF Score = 72
[152/440] Scraping SRE...
Scraping GuruFocus for SRE...
Saved GF Score for SRE
✓ SRE: GF Score = 75
[153/440] Scraping WELL...
Scraping GuruFocus for WELL...
Saved GF Score for WELL
✓ WELL: GF Score = 83
[154/440] Scraping AEP...
Scraping GuruFocus for AEP...
Saved GF Score for AEP
✓ AEP: GF Score = 81
[155/440] Scraping JCI...
Scraping GuruFocus for JCI...
Saved GF Score for JCI
✓ JCI: GF Score = 78
[156/440] Scraping O...
Scraping GuruFocus for O...
Saved GF Score for O
✓ O: GF Score = 85
[157/440] Scraping D...
Scraping GuruFocus for D...
Saved GF Score for D
✓ D: GF Score = 81
[158/440] Scraping ROP...
Scraping GuruFocus for ROP...
Saved GF Score for ROP
✓ ROP: GF Score = 80
[159/440] Scraping AIG...
Scraping GuruFocus for AIG...
Saved GF Score for AIG
✓ AIG: GF Score = 70
[160/440] Scraping PAYX...
Scraping GuruFocus for PAYX...
Saved GF Score for PAYX
✓ PAYX: GF Score = 88

Progress: 160/440 | Success: 160 | Failed: 0

[161/440] Scraping TEL...
Scraping GuruFocus for TEL...
Saved GF Score for TEL
✓ TEL: GF Score = 85
[162/440] Scraping CDNS...
Scraping GuruFocus for CDNS...
Saved GF Score for CDNS
✓ CDNS: GF Score = 99
[163/440] Scraping KMI...
Scraping GuruFocus for KMI...
Saved GF Score for KMI
✓ KMI: GF Score = 80
[164/440] Scraping ALL...
Scraping GuruFocus for ALL...
Saved GF Score for ALL
✓ ALL: GF Score = 76
[165/440] Scraping TRV...
Scraping GuruFocus for TRV...
Saved GF Score for TRV
✓ TRV: GF Score = 75
[166/440] Scraping AME...
Scraping GuruFocus for AME...
Saved GF Score for AME
✓ AME: GF Score = 94
[167/440] Scraping MSCI...
Scraping GuruFocus for MSCI...
Saved GF Score for MSCI
✓ MSCI: GF Score = 95
[168/440] Scraping CTVA...
Scraping GuruFocus for CTVA...
Saved GF Score for CTVA
✓ CTVA: GF Score = 83
[169/440] Scraping COF...
Scraping GuruFocus for COF...
Saved GF Score for COF
✓ COF: GF Score = 84
[170/440] Scraping ADM...
Scraping GuruFocus for ADM...
Saved GF Score for ADM
✓ ADM: GF Score = 84

Progress: 170/440 | Success: 170 | Failed: 0

[171/440] Scraping BK...
Scraping GuruFocus for BK...
Saved GF Score for BK
✓ BK: GF Score = 80
[172/440] Scraping HLT...
Scraping GuruFocus for HLT...
Saved GF Score for HLT
✓ HLT: GF Score = 84
[173/440] Scraping CARR...
Scraping GuruFocus for CARR...
Saved GF Score for CARR
✓ CARR: GF Score = 75
[174/440] Scraping SYY...
Scraping GuruFocus for SYY...
Saved GF Score for SYY
✓ SYY: GF Score = 90
[175/440] Scraping PRU...
Scraping GuruFocus for PRU...
Saved GF Score for PRU
✓ PRU: GF Score = 62
[176/440] Scraping DLR...
Scraping GuruFocus for DLR...
Saved GF Score for DLR
✓ DLR: GF Score = 83
[177/440] Scraping GWW...
Scraping GuruFocus for GWW...
Saved GF Score for GWW
✓ GWW: GF Score = 91
[178/440] Scraping AMP...
Scraping GuruFocus for AMP...
Saved GF Score for AMP
✓ AMP: GF Score = 87
[179/440] Scraping SPG...
Scraping GuruFocus for SPG...
Saved GF Score for SPG
✓ SPG: GF Score = 67
[180/440] Scraping OKE...
Scraping GuruFocus for OKE...
Saved GF Score for OKE
✓ OKE: GF Score = 82

Progress: 180/440 | Success: 180 | Failed: 0

[181/440] Scraping FTNT...
Scraping GuruFocus for FTNT...
Saved GF Score for FTNT
✓ FTNT: GF Score = 96
[182/440] Scraping ROST...
Scraping GuruFocus for ROST...
Saved GF Score for ROST
✓ ROST: GF Score = 93
[183/440] Scraping PH...
Scraping GuruFocus for PH...
Saved GF Score for PH
✓ PH: GF Score = 88
[184/440] Scraping HES...
Scraping GuruFocus for HES...
✗ HES: No GF Score found
[185/440] Scraping KMB...
Scraping GuruFocus for KMB...
Saved GF Score for KMB
✓ KMB: GF Score = 64
[186/440] Scraping LRCX...
Scraping GuruFocus for LRCX...
Saved GF Score for LRCX
✓ LRCX: GF Score = 94
[187/440] Scraping YUM...
Scraping GuruFocus for YUM...
Saved GF Score for YUM
✓ YUM: GF Score = 91
[188/440] Scraping EXC...
Scraping GuruFocus for EXC...
Saved GF Score for EXC
✓ EXC: GF Score = 70
[189/440] Scraping CTAS...
Scraping GuruFocus for CTAS...
Saved GF Score for CTAS
✓ CTAS: GF Score = 95
[190/440] Scraping ODFL...
Scraping GuruFocus for ODFL...
Error scraping GuruFocus data for ODFL: Attempted to use detached Frame '2DCD52D7B416D8337B0609B134C67D0A'.
✗ ODFL: Error - Connection closed.
Browser crashed, reinitializing...
GuruFocus: Browser closed

Progress: 190/440 | Success: 188 | Failed: 2

[191/440] Scraping NEM...
GuruFocus: Browser initialized
Scraping GuruFocus for NEM...
Error scraping GuruFocus data for NEM: Navigation timeout of 30000 ms exceeded
✗ NEM: No GF Score found
[192/440] Scraping CMG...
Scraping GuruFocus for CMG...
Error scraping GuruFocus data for CMG: Navigating frame was detached
✗ CMG: Error - Connection closed.
Browser crashed, reinitializing...
GuruFocus: Browser closed
[193/440] Scraping KHC...
GuruFocus: Browser initialized
Scraping GuruFocus for KHC...
Error scraping GuruFocus data for KHC: Navigation timeout of 30000 ms exceeded
✗ KHC: No GF Score found
[194/440] Scraping XEL...
Scraping GuruFocus for XEL...
Saved GF Score for XEL
✓ XEL: GF Score = 80
[195/440] Scraping FAST...
Scraping GuruFocus for FAST...
Saved GF Score for FAST
✓ FAST: GF Score = 96
[196/440] Scraping CPRT...
Scraping GuruFocus for CPRT...
Saved GF Score for CPRT
✓ CPRT: GF Score = 91
[197/440] Scraping IQV...
Scraping GuruFocus for IQV...
Saved GF Score for IQV
✓ IQV: GF Score = 94
[198/440] Scraping IDXX...
Scraping GuruFocus for IDXX...
Saved GF Score for IDXX
✓ IDXX: GF Score = 96
[199/440] Scraping VRSK...
Scraping GuruFocus for VRSK...
Saved GF Score for VRSK
✓ VRSK: GF Score = 85
[200/440] Scraping MNST...
Scraping GuruFocus for MNST...
Saved GF Score for MNST
✓ MNST: GF Score = 99

Progress: 200/440 | Success: 195 | Failed: 5

[201/440] Scraping ANET...
Scraping GuruFocus for ANET...
Saved GF Score for ANET
✓ ANET: GF Score = 97
[202/440] Scraping GIS...
Scraping GuruFocus for GIS...
Saved GF Score for GIS
✓ GIS: GF Score = 55
[203/440] Scraping OTIS...
Scraping GuruFocus for OTIS...
Saved GF Score for OTIS
✓ OTIS: GF Score = 77
[204/440] Scraping KR...
Scraping GuruFocus for KR...
Saved GF Score for KR
✓ KR: GF Score = 85
[205/440] Scraping EA...
Scraping GuruFocus for EA...
Saved GF Score for EA
✓ EA: GF Score = 90
[206/440] Scraping HSY...
Scraping GuruFocus for HSY...
Saved GF Score for HSY
✓ HSY: GF Score = 87
[207/440] Scraping A...
Scraping GuruFocus for A...
Saved GF Score for A
✓ A: GF Score = 94
[208/440] Scraping ACGL...
Scraping GuruFocus for ACGL...
Saved GF Score for ACGL
✓ ACGL: GF Score = 83
[209/440] Scraping DD...
Scraping GuruFocus for DD...
Saved GF Score for DD
✓ DD: GF Score = 74
[210/440] Scraping CTSH...
Scraping GuruFocus for CTSH...
Saved GF Score for CTSH
✓ CTSH: GF Score = 90

Progress: 210/440 | Success: 205 | Failed: 5

[211/440] Scraping ED...
Scraping GuruFocus for ED...
Saved GF Score for ED
✓ ED: GF Score = 69
[212/440] Scraping BKR...
Scraping GuruFocus for BKR...
Saved GF Score for BKR
✓ BKR: GF Score = 70
[213/440] Scraping DXCM...
Scraping GuruFocus for DXCM...
Saved GF Score for DXCM
✓ DXCM: GF Score = 83
[214/440] Scraping RSG...
Scraping GuruFocus for RSG...
Saved GF Score for RSG
✓ RSG: GF Score = 89
[215/440] Scraping CHTR...
Scraping GuruFocus for CHTR...
Saved GF Score for CHTR
✓ CHTR: GF Score = 76
[216/440] Scraping VMC...
Scraping GuruFocus for VMC...
Saved GF Score for VMC
✓ VMC: GF Score = 94
[217/440] Scraping ANSS...
Scraping GuruFocus for ANSS...
✗ ANSS: No GF Score found
[218/440] Scraping MLM...
Error scraping GuruFocus data for MLM: Connection closed.
✗ MLM: No GF Score found
[219/440] Scraping FANG...
Error scraping GuruFocus data for FANG: Connection closed.
✗ FANG: No GF Score found
[220/440] Scraping IT...
Error scraping GuruFocus data for IT: Connection closed.
✗ IT: No GF Score found

Progress: 220/440 | Success: 211 | Failed: 9

[221/440] Scraping PPG...
Error scraping GuruFocus data for PPG: Connection closed.
✗ PPG: No GF Score found
[222/440] Scraping VICI...
Error scraping GuruFocus data for VICI: Connection closed.
✗ VICI: No GF Score found
[223/440] Scraping EFX...
Error scraping GuruFocus data for EFX: Connection closed.
✗ EFX: No GF Score found
[224/440] Scraping ON...
Error scraping GuruFocus data for ON: Connection closed.
✗ ON: No GF Score found
[225/440] Scraping DOW...
Error scraping GuruFocus data for DOW: Connection closed.
✗ DOW: No GF Score found
[226/440] Scraping GLW...
Error scraping GuruFocus data for GLW: Connection closed.
✗ GLW: No GF Score found
[227/440] Scraping BIIB...
Error scraping GuruFocus data for BIIB: Connection closed.
✗ BIIB: No GF Score found
[228/440] Scraping CBRE...
Error scraping GuruFocus data for CBRE: Connection closed.
✗ CBRE: No GF Score found
[229/440] Scraping DAL...
Error scraping GuruFocus data for DAL: Connection closed.
✗ DAL: No GF Score found
[230/440] Scraping WEC...
Error scraping GuruFocus data for WEC: Connection closed.
✗ WEC: No GF Score found

Progress: 230/440 | Success: 211 | Failed: 19

[231/440] Scraping MTB...
Error scraping GuruFocus data for MTB: Connection closed.
✗ MTB: No GF Score found
[232/440] Scraping RMD...
Error scraping GuruFocus data for RMD: Connection closed.
✗ RMD: No GF Score found
[233/440] Scraping CRWD...
Error scraping GuruFocus data for CRWD: Connection closed.
✗ CRWD: No GF Score found
[234/440] Scraping AWK...
Error scraping GuruFocus data for AWK: Connection closed.
✗ AWK: No GF Score found
[235/440] Scraping STZ...
Error scraping GuruFocus data for STZ: Connection closed.
✗ STZ: No GF Score found
[236/440] Scraping HPQ...
Error scraping GuruFocus data for HPQ: Connection closed.
✗ HPQ: No GF Score found
[237/440] Scraping IFF...
Error scraping GuruFocus data for IFF: Connection closed.
✗ IFF: No GF Score found
[238/440] Scraping KEYS...
Error scraping GuruFocus data for KEYS: Connection closed.
✗ KEYS: No GF Score found
[239/440] Scraping EBAY...
Error scraping GuruFocus data for EBAY: Connection closed.
✗ EBAY: No GF Score found
[240/440] Scraping ETR...
Error scraping GuruFocus data for ETR: Connection closed.
✗ ETR: No GF Score found

Progress: 240/440 | Success: 211 | Failed: 29

[241/440] Scraping WBD...
Error scraping GuruFocus data for WBD: Connection closed.
✗ WBD: No GF Score found
[242/440] Scraping URI...
Error scraping GuruFocus data for URI: Connection closed.
✗ URI: No GF Score found
[243/440] Scraping GEHC...
Error scraping GuruFocus data for GEHC: Connection closed.
✗ GEHC: No GF Score found
[244/440] Scraping HPE...
Error scraping GuruFocus data for HPE: Connection closed.
✗ HPE: No GF Score found
[245/440] Scraping CTLT...
Error scraping GuruFocus data for CTLT: Connection closed.
✗ CTLT: No GF Score found
[246/440] Scraping WAB...
Error scraping GuruFocus data for WAB: Connection closed.
✗ WAB: No GF Score found
[247/440] Scraping AVB...
Error scraping GuruFocus data for AVB: Connection closed.
✗ AVB: No GF Score found
[248/440] Scraping DTE...
Error scraping GuruFocus data for DTE: Connection closed.
✗ DTE: No GF Score found
[249/440] Scraping FTV...
Error scraping GuruFocus data for FTV: Connection closed.
✗ FTV: No GF Score found
[250/440] Scraping MPWR...
Error scraping GuruFocus data for MPWR: Connection closed.
✗ MPWR: No GF Score found

Progress: 250/440 | Success: 211 | Failed: 39

[251/440] Scraping TTWO...
Error scraping GuruFocus data for TTWO: Connection closed.
✗ TTWO: No GF Score found
[252/440] Scraping EIX...
Error scraping GuruFocus data for EIX: Connection closed.
✗ EIX: No GF Score found
[253/440] Scraping CSGP...
Error scraping GuruFocus data for CSGP: Connection closed.
✗ CSGP: No GF Score found
[254/440] Scraping ROK...
Error scraping GuruFocus data for ROK: Connection closed.
✗ ROK: No GF Score found
[255/440] Scraping HAL...
Error scraping GuruFocus data for HAL: Connection closed.
✗ HAL: No GF Score found
[256/440] Scraping CDW...
Error scraping GuruFocus data for CDW: Connection closed.
✗ CDW: No GF Score found
[257/440] Scraping APTV...
Error scraping GuruFocus data for APTV: Connection closed.
✗ APTV: No GF Score found
[258/440] Scraping LYB...
Error scraping GuruFocus data for LYB: Connection closed.
✗ LYB: No GF Score found
[259/440] Scraping STT...
Error scraping GuruFocus data for STT: Connection closed.
✗ STT: No GF Score found
[260/440] Scraping GPN...
Error scraping GuruFocus data for GPN: Connection closed.
✗ GPN: No GF Score found

Progress: 260/440 | Success: 211 | Failed: 49

[261/440] Scraping EXR...
Error scraping GuruFocus data for EXR: Connection closed.
✗ EXR: No GF Score found
[262/440] Scraping FE...
Error scraping GuruFocus data for FE: Connection closed.
✗ FE: No GF Score found
[263/440] Scraping ES...
Error scraping GuruFocus data for ES: Connection closed.
✗ ES: No GF Score found
[264/440] Scraping PWR...
Error scraping GuruFocus data for PWR: Connection closed.
✗ PWR: No GF Score found
[265/440] Scraping ALGN...
Error scraping GuruFocus data for ALGN: Connection closed.
✗ ALGN: No GF Score found
[266/440] Scraping BALL...
Error scraping GuruFocus data for BALL: Connection closed.
✗ BALL: No GF Score found
[267/440] Scraping PPL...
Error scraping GuruFocus data for PPL: Connection closed.
✗ PPL: No GF Score found
[268/440] Scraping CNC...
Error scraping GuruFocus data for CNC: Connection closed.
✗ CNC: No GF Score found
[269/440] Scraping FITB...
Error scraping GuruFocus data for FITB: Connection closed.
✗ FITB: No GF Score found
[270/440] Scraping SBAC...
Error scraping GuruFocus data for SBAC: Connection closed.
✗ SBAC: No GF Score found

Progress: 270/440 | Success: 211 | Failed: 59

[271/440] Scraping LH...
Error scraping GuruFocus data for LH: Connection closed.
✗ LH: No GF Score found
[272/440] Scraping LVS...
Error scraping GuruFocus data for LVS: Connection closed.
✗ LVS: No GF Score found
[273/440] Scraping INVH...
Error scraping GuruFocus data for INVH: Connection closed.
✗ INVH: No GF Score found
[274/440] Scraping NTAP...
Error scraping GuruFocus data for NTAP: Connection closed.
✗ NTAP: No GF Score found
[275/440] Scraping WY...
Error scraping GuruFocus data for WY: Connection closed.
✗ WY: No GF Score found
[276/440] Scraping IR...
Error scraping GuruFocus data for IR: Connection closed.
✗ IR: No GF Score found
[277/440] Scraping CHD...
Error scraping GuruFocus data for CHD: Connection closed.
✗ CHD: No GF Score found
[278/440] Scraping VTR...
Error scraping GuruFocus data for VTR: Connection closed.
✗ VTR: No GF Score found
[279/440] Scraping MTD...
Error scraping GuruFocus data for MTD: Connection closed.
✗ MTD: No GF Score found
[280/440] Scraping TDG...
Error scraping GuruFocus data for TDG: Connection closed.
✗ TDG: No GF Score found

Progress: 280/440 | Success: 211 | Failed: 69

[281/440] Scraping AEE...
Error scraping GuruFocus data for AEE: Connection closed.
✗ AEE: No GF Score found
[282/440] Scraping CNP...
Error scraping GuruFocus data for CNP: Connection closed.
✗ CNP: No GF Score found
[283/440] Scraping CFG...
Error scraping GuruFocus data for CFG: Connection closed.
✗ CFG: No GF Score found
[284/440] Scraping CAH...
Error scraping GuruFocus data for CAH: Connection closed.
✗ CAH: No GF Score found
[285/440] Scraping ENPH...
Error scraping GuruFocus data for ENPH: Connection closed.
✗ ENPH: No GF Score found
[286/440] Scraping TSN...
Error scraping GuruFocus data for TSN: Connection closed.
✗ TSN: No GF Score found
[287/440] Scraping ZBH...
Error scraping GuruFocus data for ZBH: Connection closed.
✗ ZBH: No GF Score found
[288/440] Scraping HBAN...
Error scraping GuruFocus data for HBAN: Connection closed.
✗ HBAN: No GF Score found
[289/440] Scraping HOLX...
Error scraping GuruFocus data for HOLX: Connection closed.
✗ HOLX: No GF Score found
[290/440] Scraping MAA...
Error scraping GuruFocus data for MAA: Connection closed.
✗ MAA: No GF Score found

Progress: 290/440 | Success: 211 | Failed: 79

[291/440] Scraping LUV...
Error scraping GuruFocus data for LUV: Connection closed.
✗ LUV: No GF Score found
[292/440] Scraping TDY...
Error scraping GuruFocus data for TDY: Connection closed.
✗ TDY: No GF Score found
[293/440] Scraping EXPD...
Error scraping GuruFocus data for EXPD: Connection closed.
✗ EXPD: No GF Score found
[294/440] Scraping BAX...
Error scraping GuruFocus data for BAX: Connection closed.
✗ BAX: No GF Score found
[295/440] Scraping FDS...
Error scraping GuruFocus data for FDS: Connection closed.
✗ FDS: No GF Score found
[296/440] Scraping IRM...
Error scraping GuruFocus data for IRM: Connection closed.
✗ IRM: No GF Score found
[297/440] Scraping RJF...
Error scraping GuruFocus data for RJF: Connection closed.
✗ RJF: No GF Score found
[298/440] Scraping RF...
Error scraping GuruFocus data for RF: Connection closed.
✗ RF: No GF Score found
[299/440] Scraping UAL...
Error scraping GuruFocus data for UAL: Connection closed.
✗ UAL: No GF Score found
[300/440] Scraping DRI...
Error scraping GuruFocus data for DRI: Connection closed.
✗ DRI: No GF Score found

Progress: 300/440 | Success: 211 | Failed: 89

[301/440] Scraping NUE...
Error scraping GuruFocus data for NUE: Connection closed.
✗ NUE: No GF Score found
[302/440] Scraping WST...
Error scraping GuruFocus data for WST: Connection closed.
✗ WST: No GF Score found
[303/440] Scraping TROW...
Error scraping GuruFocus data for TROW: Connection closed.
✗ TROW: No GF Score found
[304/440] Scraping HUBB...
Error scraping GuruFocus data for HUBB: Connection closed.
✗ HUBB: No GF Score found
[305/440] Scraping ZBRA...
Error scraping GuruFocus data for ZBRA: Connection closed.
✗ ZBRA: No GF Score found
[306/440] Scraping MKC...
Error scraping GuruFocus data for MKC: Connection closed.
✗ MKC: No GF Score found
[307/440] Scraping NVR...
Error scraping GuruFocus data for NVR: Connection closed.
✗ NVR: No GF Score found
[308/440] Scraping CMS...
Error scraping GuruFocus data for CMS: Connection closed.
✗ CMS: No GF Score found
[309/440] Scraping STE...
Error scraping GuruFocus data for STE: Connection closed.
✗ STE: No GF Score found
[310/440] Scraping ULTA...
Error scraping GuruFocus data for ULTA: Connection closed.
✗ ULTA: No GF Score found

Progress: 310/440 | Success: 211 | Failed: 99

[311/440] Scraping PKI...
Error scraping GuruFocus data for PKI: Connection closed.
✗ PKI: No GF Score found
[312/440] Scraping DPZ...
Error scraping GuruFocus data for DPZ: Connection closed.
✗ DPZ: No GF Score found
[313/440] Scraping PFG...
Error scraping GuruFocus data for PFG: Connection closed.
✗ PFG: No GF Score found
[314/440] Scraping K...
Error scraping GuruFocus data for K: Connection closed.
✗ K: No GF Score found
[315/440] Scraping STLD...
Error scraping GuruFocus data for STLD: Connection closed.
✗ STLD: No GF Score found
[316/440] Scraping KEY...
Error scraping GuruFocus data for KEY: Connection closed.
✗ KEY: No GF Score found
[317/440] Scraping MOH...
Error scraping GuruFocus data for MOH: Connection closed.
✗ MOH: No GF Score found
[318/440] Scraping EXPE...
Error scraping GuruFocus data for EXPE: Connection closed.
✗ EXPE: No GF Score found
[319/440] Scraping J...
Error scraping GuruFocus data for J: Connection closed.
✗ J: No GF Score found
[320/440] Scraping LEN...
Error scraping GuruFocus data for LEN: Connection closed.
✗ LEN: No GF Score found

Progress: 320/440 | Success: 211 | Failed: 109

[321/440] Scraping CAG...
Error scraping GuruFocus data for CAG: Connection closed.
✗ CAG: No GF Score found
[322/440] Scraping DGX...
Error scraping GuruFocus data for DGX: Connection closed.
✗ DGX: No GF Score found
[323/440] Scraping NTRS...
Error scraping GuruFocus data for NTRS: Connection closed.
✗ NTRS: No GF Score found
[324/440] Scraping SYF...
Error scraping GuruFocus data for SYF: Connection closed.
✗ SYF: No GF Score found
[325/440] Scraping CINF...
Error scraping GuruFocus data for CINF: Connection closed.
✗ CINF: No GF Score found
[326/440] Scraping WAT...
Error scraping GuruFocus data for WAT: Connection closed.
✗ WAT: No GF Score found
[327/440] Scraping PODD...
Error scraping GuruFocus data for PODD: Connection closed.
✗ PODD: No GF Score found
[328/440] Scraping AKAM...
Error scraping GuruFocus data for AKAM: Connection closed.
✗ AKAM: No GF Score found
[329/440] Scraping ESS...
Error scraping GuruFocus data for ESS: Connection closed.
✗ ESS: No GF Score found
[330/440] Scraping ARE...
Error scraping GuruFocus data for ARE: Connection closed.
✗ ARE: No GF Score found

Progress: 330/440 | Success: 211 | Failed: 119

[331/440] Scraping BBY...
Error scraping GuruFocus data for BBY: Connection closed.
✗ BBY: No GF Score found
[332/440] Scraping POOL...
Error scraping GuruFocus data for POOL: Connection closed.
✗ POOL: No GF Score found
[333/440] Scraping JBHT...
Error scraping GuruFocus data for JBHT: Connection closed.
✗ JBHT: No GF Score found
[334/440] Scraping OMC...
Error scraping GuruFocus data for OMC: Connection closed.
✗ OMC: No GF Score found
[335/440] Scraping BBWI...
Error scraping GuruFocus data for BBWI: Connection closed.
✗ BBWI: No GF Score found
[336/440] Scraping TYL...
Error scraping GuruFocus data for TYL: Connection closed.
✗ TYL: No GF Score found
[337/440] Scraping CFR...
Error scraping GuruFocus data for CFR: Connection closed.
✗ CFR: No GF Score found
[338/440] Scraping SWK...
Error scraping GuruFocus data for SWK: Connection closed.
✗ SWK: No GF Score found
[339/440] Scraping EQR...
Error scraping GuruFocus data for EQR: Connection closed.
✗ EQR: No GF Score found
[340/440] Scraping PAYC...
Error scraping GuruFocus data for PAYC: Connection closed.
✗ PAYC: No GF Score found

Progress: 340/440 | Success: 211 | Failed: 129

[341/440] Scraping INCY...
Error scraping GuruFocus data for INCY: Connection closed.
✗ INCY: No GF Score found
[342/440] Scraping EVRG...
Error scraping GuruFocus data for EVRG: Connection closed.
✗ EVRG: No GF Score found
[343/440] Scraping LYV...
Error scraping GuruFocus data for LYV: Connection closed.
✗ LYV: No GF Score found
[344/440] Scraping L...
Error scraping GuruFocus data for L: Connection closed.
✗ L: No GF Score found
[345/440] Scraping VRSN...
Error scraping GuruFocus data for VRSN: Connection closed.
✗ VRSN: No GF Score found
[346/440] Scraping LDOS...
Error scraping GuruFocus data for LDOS: Connection closed.
✗ LDOS: No GF Score found
[347/440] Scraping KIM...
Error scraping GuruFocus data for KIM: Connection closed.
✗ KIM: No GF Score found
[348/440] Scraping CHRW...
Error scraping GuruFocus data for CHRW: Connection closed.
✗ CHRW: No GF Score found
[349/440] Scraping TER...
Error scraping GuruFocus data for TER: Connection closed.
✗ TER: No GF Score found
[350/440] Scraping VTRS...
Error scraping GuruFocus data for VTRS: Connection closed.
✗ VTRS: No GF Score found

Progress: 350/440 | Success: 211 | Failed: 139

[351/440] Scraping IEX...
Error scraping GuruFocus data for IEX: Connection closed.
✗ IEX: No GF Score found
[352/440] Scraping FICO...
Error scraping GuruFocus data for FICO: Connection closed.
✗ FICO: No GF Score found
[353/440] Scraping ATO...
Error scraping GuruFocus data for ATO: Connection closed.
✗ ATO: No GF Score found
[354/440] Scraping DOV...
Error scraping GuruFocus data for DOV: Connection closed.
✗ DOV: No GF Score found
[355/440] Scraping CE...
Error scraping GuruFocus data for CE: Connection closed.
✗ CE: No GF Score found
[356/440] Scraping CLX...
Error scraping GuruFocus data for CLX: Connection closed.
✗ CLX: No GF Score found
[357/440] Scraping AMCR...
Error scraping GuruFocus data for AMCR: Connection closed.
✗ AMCR: No GF Score found
[358/440] Scraping PKG...
Error scraping GuruFocus data for PKG: Connection closed.
✗ PKG: No GF Score found
[359/440] Scraping TECH...
Error scraping GuruFocus data for TECH: Connection closed.
✗ TECH: No GF Score found
[360/440] Scraping PARA...
Error scraping GuruFocus data for PARA: Connection closed.
✗ PARA: No GF Score found

Progress: 360/440 | Success: 211 | Failed: 149

[361/440] Scraping TRGP...
Error scraping GuruFocus data for TRGP: Connection closed.
✗ TRGP: No GF Score found
[362/440] Scraping SEDG...
Error scraping GuruFocus data for SEDG: Connection closed.
✗ SEDG: No GF Score found
[363/440] Scraping AVY...
Error scraping GuruFocus data for AVY: Connection closed.
✗ AVY: No GF Score found
[364/440] Scraping BXP...
Error scraping GuruFocus data for BXP: Connection closed.
✗ BXP: No GF Score found
[365/440] Scraping SWKS...
Error scraping GuruFocus data for SWKS: Connection closed.
✗ SWKS: No GF Score found
[366/440] Scraping DFS...
Error scraping GuruFocus data for DFS: Connection closed.
✗ DFS: No GF Score found
[367/440] Scraping BRO...
Error scraping GuruFocus data for BRO: Connection closed.
✗ BRO: No GF Score found
[368/440] Scraping CPT...
Error scraping GuruFocus data for CPT: Connection closed.
✗ CPT: No GF Score found
[369/440] Scraping BF.B...
Error scraping GuruFocus data for BF.B: Connection closed.
✗ BF.B: No GF Score found
[370/440] Scraping LKQ...
Error scraping GuruFocus data for LKQ: Connection closed.
✗ LKQ: No GF Score found

Progress: 370/440 | Success: 211 | Failed: 159

[371/440] Scraping JKHY...
Error scraping GuruFocus data for JKHY: Connection closed.
✗ JKHY: No GF Score found
[372/440] Scraping UDR...
Error scraping GuruFocus data for UDR: Connection closed.
✗ UDR: No GF Score found
[373/440] Scraping CBOE...
Error scraping GuruFocus data for CBOE: Connection closed.
✗ CBOE: No GF Score found
[374/440] Scraping REG...
Error scraping GuruFocus data for REG: Connection closed.
✗ REG: No GF Score found
[375/440] Scraping MAS...
Error scraping GuruFocus data for MAS: Connection closed.
✗ MAS: No GF Score found
[376/440] Scraping HSIC...
Error scraping GuruFocus data for HSIC: Connection closed.
✗ HSIC: No GF Score found
[377/440] Scraping CPB...
Error scraping GuruFocus data for CPB: Connection closed.
✗ CPB: No GF Score found
[378/440] Scraping APA...
Error scraping GuruFocus data for APA: Connection closed.
✗ APA: No GF Score found
[379/440] Scraping EPAM...
Error scraping GuruFocus data for EPAM: Connection closed.
✗ EPAM: No GF Score found
[380/440] Scraping TTWO...
Error scraping GuruFocus data for TTWO: Connection closed.
✗ TTWO: No GF Score found

Progress: 380/440 | Success: 211 | Failed: 169

[381/440] Scraping AAL...
Error scraping GuruFocus data for AAL: Connection closed.
✗ AAL: No GF Score found
[382/440] Scraping EMN...
Error scraping GuruFocus data for EMN: Connection closed.
✗ EMN: No GF Score found
[383/440] Scraping GNRC...
Error scraping GuruFocus data for GNRC: Connection closed.
✗ GNRC: No GF Score found
[384/440] Scraping CCL...
Error scraping GuruFocus data for CCL: Connection closed.
✗ CCL: No GF Score found
[385/440] Scraping KMX...
Error scraping GuruFocus data for KMX: Connection closed.
✗ KMX: No GF Score found
[386/440] Scraping WRB...
Error scraping GuruFocus data for WRB: Connection closed.
✗ WRB: No GF Score found
[387/440] Scraping HII...
Error scraping GuruFocus data for HII: Connection closed.
✗ HII: No GF Score found
[388/440] Scraping PNR...
Error scraping GuruFocus data for PNR: Connection closed.
✗ PNR: No GF Score found
[389/440] Scraping NDAQ...
Error scraping GuruFocus data for NDAQ: Connection closed.
✗ NDAQ: No GF Score found
[390/440] Scraping AIZ...
Error scraping GuruFocus data for AIZ: Connection closed.
✗ AIZ: No GF Score found

Progress: 390/440 | Success: 211 | Failed: 179

[391/440] Scraping HRL...
Error scraping GuruFocus data for HRL: Connection closed.
✗ HRL: No GF Score found
[392/440] Scraping HWM...
Error scraping GuruFocus data for HWM: Connection closed.
✗ HWM: No GF Score found
[393/440] Scraping CRL...
Error scraping GuruFocus data for CRL: Connection closed.
✗ CRL: No GF Score found
[394/440] Scraping IPG...
Error scraping GuruFocus data for IPG: Connection closed.
✗ IPG: No GF Score found
[395/440] Scraping LNT...
Error scraping GuruFocus data for LNT: Connection closed.
✗ LNT: No GF Score found
[396/440] Scraping MTCH...
Error scraping GuruFocus data for MTCH: Connection closed.
✗ MTCH: No GF Score found
[397/440] Scraping MGM...
Error scraping GuruFocus data for MGM: Connection closed.
✗ MGM: No GF Score found
[398/440] Scraping TAP...
Error scraping GuruFocus data for TAP: Connection closed.
✗ TAP: No GF Score found
[399/440] Scraping AOS...
Error scraping GuruFocus data for AOS: Connection closed.
✗ AOS: No GF Score found
[400/440] Scraping BWA...
Error scraping GuruFocus data for BWA: Connection closed.
✗ BWA: No GF Score found

Progress: 400/440 | Success: 211 | Failed: 189

[401/440] Scraping FFIV...
Error scraping GuruFocus data for FFIV: Connection closed.
✗ FFIV: No GF Score found
[402/440] Scraping HST...
Error scraping GuruFocus data for HST: Connection closed.
✗ HST: No GF Score found
[403/440] Scraping FOXA...
Error scraping GuruFocus data for FOXA: Connection closed.
✗ FOXA: No GF Score found
[404/440] Scraping FOX...
Error scraping GuruFocus data for FOX: Connection closed.
✗ FOX: No GF Score found
[405/440] Scraping NWSA...
Error scraping GuruFocus data for NWSA: Connection closed.
✗ NWSA: No GF Score found
[406/440] Scraping NWS...
Error scraping GuruFocus data for NWS: Connection closed.
✗ NWS: No GF Score found
[407/440] Scraping DISH...
Error scraping GuruFocus data for DISH: Connection closed.
✗ DISH: No GF Score found
[408/440] Scraping DVA...
Error scraping GuruFocus data for DVA: Connection closed.
✗ DVA: No GF Score found
[409/440] Scraping FRT...
Error scraping GuruFocus data for FRT: Connection closed.
✗ FRT: No GF Score found
[410/440] Scraping JNPR...
Error scraping GuruFocus data for JNPR: Connection closed.
✗ JNPR: No GF Score found

Progress: 410/440 | Success: 211 | Failed: 199

[411/440] Scraping ALB...
Error scraping GuruFocus data for ALB: Connection closed.
✗ ALB: No GF Score found
[412/440] Scraping GL...
Error scraping GuruFocus data for GL: Connection closed.
✗ GL: No GF Score found
[413/440] Scraping BEN...
Error scraping GuruFocus data for BEN: Connection closed.
✗ BEN: No GF Score found
[414/440] Scraping QRVO...
Error scraping GuruFocus data for QRVO: Connection closed.
✗ QRVO: No GF Score found
[415/440] Scraping SJM...
Error scraping GuruFocus data for SJM: Connection closed.
✗ SJM: No GF Score found
[416/440] Scraping WYNN...
Error scraping GuruFocus data for WYNN: Connection closed.
✗ WYNN: No GF Score found
[417/440] Scraping RL...
Error scraping GuruFocus data for RL: Connection closed.
✗ RL: No GF Score found
[418/440] Scraping NCLH...
Error scraping GuruFocus data for NCLH: Connection closed.
✗ NCLH: No GF Score found
[419/440] Scraping PNW...
Error scraping GuruFocus data for PNW: Connection closed.
✗ PNW: No GF Score found
[420/440] Scraping SEE...
Error scraping GuruFocus data for SEE: Connection closed.
✗ SEE: No GF Score found

Progress: 420/440 | Success: 211 | Failed: 209

[421/440] Scraping ALLE...
Error scraping GuruFocus data for ALLE: Connection closed.
✗ ALLE: No GF Score found
[422/440] Scraping TPR...
Error scraping GuruFocus data for TPR: Connection closed.
✗ TPR: No GF Score found
[423/440] Scraping MHK...
Error scraping GuruFocus data for MHK: Connection closed.
✗ MHK: No GF Score found
[424/440] Scraping IVZ...
Error scraping GuruFocus data for IVZ: Connection closed.
✗ IVZ: No GF Score found
[425/440] Scraping ZION...
Error scraping GuruFocus data for ZION: Connection closed.
✗ ZION: No GF Score found
[426/440] Scraping AIV...
Error scraping GuruFocus data for AIV: Connection closed.
✗ AIV: No GF Score found
[427/440] Scraping UHS...
Error scraping GuruFocus data for UHS: Connection closed.
✗ UHS: No GF Score found
[428/440] Scraping NI...
Error scraping GuruFocus data for NI: Connection closed.
✗ NI: No GF Score found
[429/440] Scraping CMA...
Error scraping GuruFocus data for CMA: Connection closed.
✗ CMA: No GF Score found
[430/440] Scraping WHR...
Error scraping GuruFocus data for WHR: Connection closed.
✗ WHR: No GF Score found

Progress: 430/440 | Success: 211 | Failed: 219

[431/440] Scraping PBCT...
Error scraping GuruFocus data for PBCT: Connection closed.
✗ PBCT: No GF Score found
[432/440] Scraping HAS...
Error scraping GuruFocus data for HAS: Connection closed.
✗ HAS: No GF Score found
[433/440] Scraping ROL...
Error scraping GuruFocus data for ROL: Connection closed.
✗ ROL: No GF Score found
[434/440] Scraping NLSN...
Error scraping GuruFocus data for NLSN: Connection closed.
✗ NLSN: No GF Score found
[435/440] Scraping ALK...
Error scraping GuruFocus data for ALK: Connection closed.
✗ ALK: No GF Score found
[436/440] Scraping PENN...
Error scraping GuruFocus data for PENN: Connection closed.
✗ PENN: No GF Score found
[437/440] Scraping VNO...
Error scraping GuruFocus data for VNO: Connection closed.
✗ VNO: No GF Score found
[438/440] Scraping PLTR...
Error scraping GuruFocus data for PLTR: Connection closed.
✗ PLTR: No GF Score found
[439/440] Scraping SNOW...
Error scraping GuruFocus data for SNOW: Connection closed.
✗ SNOW: No GF Score found
[440/440] Scraping PANW...
Error scraping GuruFocus data for PANW: Connection closed.
✗ PANW: No GF Score found

Progress: 440/440 | Success: 211 | Failed: 229

GuruFocus: Browser closed

=== GuruFocus Scraping Complete ===
Total: 440 | Success: 211 | Failed: 229
Failed symbols: HES, ODFL, NEM, CMG, KHC, ANSS, MLM, FANG, IT, PPG, VICI, EFX, ON, DOW, GLW, BIIB, CBRE, DAL, WEC, MTB, RMD, CRWD, AWK, STZ, HPQ, IFF, KEYS, EBAY, ETR, WBD, URI, GEHC, HPE, CTLT, WAB, AVB, DTE, FTV, MPWR, TTWO, EIX, CSGP, ROK, HAL, CDW, APTV, LYB, STT, GPN, EXR, FE, ES, PWR, ALGN, BALL, PPL, CNC, FITB, SBAC, LH, LVS, INVH, NTAP, WY, IR, CHD, VTR, MTD, TDG, AEE, CNP, CFG, CAH, ENPH, TSN, ZBH, HBAN, HOLX, MAA, LUV, TDY, EXPD, BAX, FDS, IRM, RJF, RF, UAL, DRI, NUE, WST, TROW, HUBB, ZBRA, MKC, NVR, CMS, STE, ULTA, PKI, DPZ, PFG, K, STLD, KEY, MOH, EXPE, J, LEN, CAG, DGX, NTRS, SYF, CINF, WAT, PODD, AKAM, ESS, ARE, BBY, POOL, JBHT, OMC, BBWI, TYL, CFR, SWK, EQR, PAYC, INCY, EVRG, LYV, L, VRSN, LDOS, KIM, CHRW, TER, VTRS, IEX, FICO, ATO, DOV, CE, CLX, AMCR, PKG, TECH, PARA, TRGP, SEDG, AVY, BXP, SWKS, DFS, BRO, CPT, BF.B, LKQ, JKHY, UDR, CBOE, REG, MAS, HSIC, CPB, APA, EPAM, TTWO, AAL, EMN, GNRC, CCL, KMX, WRB, HII, PNR, NDAQ, AIZ, HRL, HWM, CRL, IPG, LNT, MTCH, MGM, TAP, AOS, BWA, FFIV, HST, FOXA, FOX, NWSA, NWS, DISH, DVA, FRT, JNPR, ALB, GL, BEN, QRVO, SJM, WYNN, RL, NCLH, PNW, SEE, ALLE, TPR, MHK, IVZ, ZION, AIV, UHS, NI, CMA, WHR, PBCT, HAS, ROL, NLSN, ALK, PENN, VNO, PLTR, SNOW, PANW

=== Final Results ===
Total stocks: 440
Successfully scraped: 211
Failed: 229
Success rate: 48.0%
Duration: 59 minutes
Completed at: 3:27:35 PM

Failed symbols (229): HES, ODFL, NEM, CMG, KHC, ANSS, MLM, FANG, IT, PPG, VICI, EFX, ON, DOW, GLW, BIIB, CBRE, DAL, WEC, MTB, RMD, CRWD, AWK, STZ, HPQ, IFF, KEYS, EBAY, ETR, WBD, URI, GEHC, HPE, CTLT, WAB, AVB, DTE, FTV, MPWR, TTWO, EIX, CSGP, ROK, HAL, CDW, APTV, LYB, STT, GPN, EXR, FE, ES, PWR, ALGN, BALL, PPL, CNC, FITB, SBAC, LH, LVS, INVH, NTAP, WY, IR, CHD, VTR, MTD, TDG, AEE, CNP, CFG, CAH, ENPH, TSN, ZBH, HBAN, HOLX, MAA, LUV, TDY, EXPD, BAX, FDS, IRM, RJF, RF, UAL, DRI, NUE, WST, TROW, HUBB, ZBRA, MKC, NVR, CMS, STE, ULTA, PKI, DPZ, PFG, K, STLD, KEY, MOH, EXPE, J, LEN, CAG, DGX, NTRS, SYF, CINF, WAT, PODD, AKAM, ESS, ARE, BBY, POOL, JBHT, OMC, BBWI, TYL, CFR, SWK, EQR, PAYC, INCY, EVRG, LYV, L, VRSN, LDOS, KIM, CHRW, TER, VTRS, IEX, FICO, ATO, DOV, CE, CLX, AMCR, PKG, TECH, PARA, TRGP, SEDG, AVY, BXP, SWKS, DFS, BRO, CPT, BF.B, LKQ, JKHY, UDR, CBOE, REG, MAS, HSIC, CPB, APA, EPAM, TTWO, AAL, EMN, GNRC, CCL, KMX, WRB, HII, PNR, NDAQ, AIZ, HRL, HWM, CRL, IPG, LNT, MTCH, MGM, TAP, AOS, BWA, FFIV, HST, FOXA, FOX, NWSA, NWS, DISH, DVA, FRT, JNPR, ALB, GL, BEN, QRVO, SJM, WYNN, RL, NCLH, PNW, SEE, ALLE, TPR, MHK, IVZ, ZION, AIV, UHS, NI, CMA, WHR, PBCT, HAS, ROL, NLSN, ALK, PENN, VNO, PLTR, SNOW, PANW

=== Database Check ===
Total GF Scores in database: 211

Sample scores (first 5):
  AAPL: GF Score = 96, GF Value = $219.65
  MSFT: GF Score = 99, GF Value = $505.63
  GOOGL: GF Score = 94, GF Value = $196.48
  AMZN: GF Score = 94, GF Value = $null
  NVDA: GF Score = 100, GF Value = $null
